1|1|Tura u Beogradu|7|Setnja do Kalemegdana, obilazak Avale.|5|20|3|file:///C:/Users/hp/Desktop/slike_za_projekat/BelgradeTour.jpg |09-Apr-23 15:00:00|False
2|1|Tura u Novom Sadu|8|Nalazimo se kod katedrale u centru, setnja po Dunavskom parku i obilazak Petrovaradinske tvrdjave.|6|15|4|file:///C:/Users/hp/Desktop/slike_za_projekat/NoviSadTour.jpg |10-Apr-23 12:00:00|False
3|1|Obilazak muzeja Mileve Maric|8|Obilzak muzeja Mileve Maric na tvrdjavi.|7|18|3|file:///C:/Users/hp/Desktop/slike_za_projekat/mileva-1.jpg |9-Apr-23 17:00:00|False
4|1|Obilazak Starog Rima|10|Obilazak kulturnih znamenitosti Starog Rima.|8|40|4|file:///C:/Users/hp/Desktop/slike_za_projekat/download.jfif ,file:///C:/Users/hp/Desktop/slike_za_projekat/rim.jpg |8-Apr-23 10:00:00|False
5|1|Sremski Karlovci|8|Obilazak Karlovacke gimnazije, Saborne Crkve.|9|10|2|file:///C:/Users/hp/Desktop/slike_za_projekat/karlovackagim.jfif |4-Apr-23 00:00:00|False
6|1|Tura1|13|opis|10|5|1|file:///C:/Users/hp/Desktop/slike_za_projekat/lake.jpg |22-Mar-23 17:00:00|True